{
  "schemaVersion": 1,
  "adapter": "axure",
  "build": "11.0.0.4150",
  "checklist": [
    {
      "id": "environment",
      "assertion": "Pinned build, explicit paths, process and doctor; activation/editability checked separately."
    },
    {
      "id": "request",
      "assertion": "Correct identity and units; malformed requests rejected; JSON results and legacy compatibility retained."
    },
    {
      "id": "receipt",
      "assertion": "Operation state, ID/input collision, write serialization, timeout, late completion and no automatic mutation replay."
    },
    {
      "id": "native-state",
      "assertion": "Inspect actual before/after objects and preserve unrelated content."
    },
    {
      "id": "persistence",
      "assertion": "Save convergence and explicitly scoped reopen; distinguish same-session from cold startup."
    },
    {
      "id": "artifact",
      "assertion": "Native output and independent media/browser/geometry validation; absence of overwrite."
    },
    {
      "id": "restoration",
      "assertion": "Retain failures, restore previous user project or verified model parameters; no mouse input."
    }
  ],
  "tools": [
    {
      "name": "status",
      "coverage": "current-native",
      "evidence": [
        "evidence/upgrade-20261014.json"
      ],
      "scope": "Exact command executed in the dated bounded workflow; not every argument combination."
    },
    {
      "name": "inspect",
      "coverage": "current-native",
      "evidence": [
        "evidence/upgrade-20261014.json"
      ],
      "scope": "Exact command executed in the dated bounded workflow; not every argument combination."
    },
    {
      "name": "undo",
      "coverage": "current-native",
      "evidence": [
        "evidence/upgrade-20261014.json"
      ],
      "scope": "Exact command executed in the dated bounded workflow; not every argument combination."
    },
    {
      "name": "redo",
      "coverage": "current-native",
      "evidence": [
        "evidence/upgrade-20261014.json"
      ],
      "scope": "Exact command executed in the dated bounded workflow; not every argument combination."
    },
    {
      "name": "capabilities",
      "coverage": "not-run",
      "evidence": [],
      "scope": "No current native acceptance claim; see schema, adapter guide and offline tests."
    },
    {
      "name": "launch",
      "coverage": "current-native",
      "evidence": [
        "evidence/upgrade-20261014.json"
      ],
      "scope": "Exact command executed in the dated bounded workflow; not every argument combination."
    },
    {
      "name": "widget.list",
      "coverage": "not-run",
      "evidence": [],
      "scope": "No current native acceptance claim; see schema, adapter guide and offline tests."
    },
    {
      "name": "widget.create",
      "coverage": "current-native",
      "evidence": [
        "evidence/upgrade-20261014.json"
      ],
      "scope": "Exact command executed in the dated bounded workflow; not every argument combination."
    },
    {
      "name": "widget.bounds",
      "coverage": "current-native",
      "evidence": [
        "evidence/upgrade-20261014.json"
      ],
      "scope": "Exact command executed in the dated bounded workflow; not every argument combination."
    },
    {
      "name": "widget.text",
      "coverage": "not-run",
      "evidence": [],
      "scope": "No current native acceptance claim; see schema, adapter guide and offline tests."
    },
    {
      "name": "page.list",
      "coverage": "current-native",
      "evidence": [
        "evidence/upgrade-20261014.json"
      ],
      "scope": "Exact command executed in the dated bounded workflow; not every argument combination."
    },
    {
      "name": "page.create",
      "coverage": "current-native",
      "evidence": [
        "evidence/upgrade-20261014.json"
      ],
      "scope": "Exact command executed in the dated bounded workflow; not every argument combination."
    },
    {
      "name": "page.open",
      "coverage": "current-native",
      "evidence": [
        "evidence/upgrade-20261014.json"
      ],
      "scope": "Exact command executed in the dated bounded workflow; not every argument combination."
    },
    {
      "name": "interaction.get",
      "coverage": "current-native",
      "evidence": [
        "evidence/upgrade-20261014.json"
      ],
      "scope": "Exact command executed in the dated bounded workflow; not every argument combination."
    },
    {
      "name": "interaction.set",
      "coverage": "current-native",
      "evidence": [
        "evidence/upgrade-20261014.json"
      ],
      "scope": "Exact command executed in the dated bounded workflow; not every argument combination."
    },
    {
      "name": "project.new",
      "coverage": "current-native",
      "evidence": [
        "evidence/upgrade-20261014.json"
      ],
      "scope": "Exact command executed in the dated bounded workflow; not every argument combination."
    },
    {
      "name": "project.close",
      "coverage": "current-native",
      "evidence": [
        "evidence/upgrade-20261014.json"
      ],
      "scope": "Exact command executed in the dated bounded workflow; not every argument combination."
    },
    {
      "name": "project.sitemap",
      "coverage": "not-run",
      "evidence": [],
      "scope": "No current native acceptance claim; see schema, adapter guide and offline tests."
    },
    {
      "name": "project.save",
      "coverage": "current-native",
      "evidence": [
        "evidence/upgrade-20261014.json"
      ],
      "scope": "Exact command executed in the dated bounded workflow; not every argument combination."
    },
    {
      "name": "project.open",
      "coverage": "current-native",
      "evidence": [
        "evidence/upgrade-20261014.json"
      ],
      "scope": "Exact command executed in the dated bounded workflow; not every argument combination."
    },
    {
      "name": "export.html",
      "coverage": "current-native",
      "evidence": [
        "evidence/upgrade-20261014.json"
      ],
      "scope": "Exact command executed in the dated bounded workflow; not every argument combination."
    },
    {
      "name": "settings.cache",
      "coverage": "not-run",
      "evidence": [],
      "scope": "No current native acceptance claim; see schema, adapter guide and offline tests."
    }
  ]
}
